21:54:12.366256 Out 30:f7:72:29:e1:d3 ethertype IPv4 (0x0800), length 185: 192.168.43.135.5353 > 224.0.0.251.5353: 0 [9q] PTR (QM)? _nfs._tcp.local. PTR (QM)? _ipp._tcp.local. PTR (QM)? _ipps._tcp.local. PTR (QM)? _ftp._tcp.local. PTR (QM)? _webdav._tcp.local. PTR (QM)? _webdavs._tcp.local. PTR (QM)? _sftp-ssh._tcp.local. PTR (QM)? _smb._tcp.local. PTR (QM)? _afpovertcp._tcp.local. (141)
21:54:12.659611 Out 30:f7:72:29:e1:d3 ethertype IPv4 (0x0800), length 68: 192.168.43.135.36996 > 192.30.253.112.443: Flags [.], ack 1267828794, win 594, options [nop,nop,TS val 2028114313 ecr 2518858142], length 0
21:54:13.532254  In 38:a4:ed:e1:ac:7f ethertype IPv4 (0x0800), length 68: 192.30.253.112.443 > 192.168.43.135.36996: Flags [.], ack 1, win 41, options [nop,nop,TS val 2518860895 ecr 2028072065], length 0
21:54:14.963714 Out 30:f7:72:29:e1:d3 ethertype IPv4 (0x0800), length 68: 192.168.43.135.36992 > 192.30.253.112.443: Flags [.], ack 3445405431, win 1444, options [nop,nop,TS val 2028116614 ecr 2518858845], length 0
21:54:15.219713 Out 30:f7:72:29:e1:d3 ethertype IPv4 (0x0800), length 68: 192.168.43.135.48374 > 34.199.95.10.443: Flags [.], ack 1954257211, win 335, options [nop,nop,TS val 3148292008 ecr 304096636], length 0
21:54:15.379005  In 38:a4:ed:e1:ac:7f ethertype IPv4 (0x0800), length 68: 192.30.253.112.443 > 192.168.43.135.36992: Flags [.], ack 1, win 44, options [nop,nop,TS val 2518861460 ecr 2028074740], length 0
21:54:15.502720  In 38:a4:ed:e1:ac:7f ethertype IPv4 (0x0800), length 68: 34.199.95.10.443 > 192.168.43.135.48374: Flags [.], ack 1, win 66, options [nop,nop,TS val 304099253 ecr 3148250328], length 0
21:54:15.731629 Out 30:f7:72:29:e1:d3 ethertype IPv4 (0x0800), length 68: 192.168.43.135.55536 > 35.171.223.36.443: Flags [.], ack 4221431977, win 263, options [nop,nop,TS val 1421415821 ecr 115182385], length 0
21:54:16.110624  In 38:a4:ed:e1:ac:7f ethertype IPv4 (0x0800), length 68: 35.171.223.36.443 > 192.168.43.135.55536: Flags [.], ack 1, win 176, options [nop,nop,TS val 115185063 ecr 1421373930], length 0
21:54:17.267663 Out 30:f7:72:29:e1:d3 ethertype IPv4 (0x0800), length 68: 192.168.43.135.42124 > 192.30.253.116.443: Flags [.], ack 2991470160, win 277, options [nop,nop,TS val 3603306709 ecr 1865474420], length 0
21:54:17.365379  In 38:a4:ed:e1:ac:7f ethertype IPv4 (0x0800), length 99: 91.189.92.19.443 > 192.168.43.135.41986: Flags [P.], seq 729203147:729203178, ack 3117125030, win 405, options [nop,nop,TS val 2636878001 ecr 276689685], length 31
21:54:17.365406  In 38:a4:ed:e1:ac:7f ethertype IPv4 (0x0800), length 68: 91.189.92.19.443 > 192.168.43.135.41986: Flags [F.], seq 31, ack 1, win 405, options [nop,nop,TS val 2636878001 ecr 276689685], length 0
21:54:17.365536 Out 30:f7:72:29:e1:d3 ethertype IPv4 (0x0800), length 99: 192.168.43.135.41986 > 91.189.92.19.443: Flags [P.], seq 1:32, ack 32, win 840, options [nop,nop,TS val 276739661 ecr 2636878001], length 31
21:54:17.365583 Out 30:f7:72:29:e1:d3 ethertype IPv4 (0x0800), length 68: 192.168.43.135.41986 > 91.189.92.19.443: Flags [F.], seq 32, ack 32, win 840, options [nop,nop,TS val 276739661 ecr 2636878001], length 0
21:54:17.691308  In 38:a4:ed:e1:ac:7f ethertype IPv4 (0x0800), length 56: 91.189.92.19.443 > 192.168.43.135.41986: Flags [R], seq 729203179, win 0, length 0
21:54:17.691359  In 38:a4:ed:e1:ac:7f ethertype IPv4 (0x0800), length 56: 91.189.92.19.443 > 192.168.43.135.41986: Flags [R], seq 729203179, win 0, length 0
21:54:17.691364  In 38:a4:ed:e1:ac:7f ethertype IPv4 (0x0800), length 68: 192.30.253.116.443 > 192.168.43.135.42124: Flags [.], ack 1, win 76, options [nop,nop,TS val 1865477103 ecr 3603264736], length 0
21:54:20.083630 Out 30:f7:72:29:e1:d3 ethertype IPv4 (0x0800), length 68: 192.168.43.135.45068 > 117.18.237.29.80: Flags [.], ack 1492748364, win 266, options [nop,nop,TS val 1038250824 ecr 1332308536], length 0
21:54:20.163900  In 38:a4:ed:e1:ac:7f ethertype IPv4 (0x0800), length 68: 117.18.237.29.80 > 192.168.43.135.45068: Flags [.], ack 1, win 290, options [nop,nop,TS val 1332311089 ecr 1038148228], length 0
21:54:23.374652  In 38:a4:ed:e1:ac:7f ethertype IPv4 (0x0800), length 99: 192.30.253.124.443 > 192.168.43.135.37698: Flags [P.], seq 3779396572:3779396603, ack 2868642209, win 31, options [nop,nop,TS val 1881275986 ecr 417365321], length 31
21:54:23.374884 Out 30:f7:72:29:e1:d3 ethertype IPv4 (0x0800), length 103: 192.168.43.135.37698 > 192.30.253.124.443: Flags [P.], seq 1:36, ack 31, win 245, options [nop,nop,TS val 417426143 ecr 1881275986], length 35
21:54:23.667589 Out 30:f7:72:29:e1:d3 ethertype IPv4 (0x0800), length 68: 192.168.43.135.36996 > 192.30.253.112.443: Flags [.], ack 1, win 594, options [nop,nop,TS val 2028125308 ecr 2518860895], length 0
21:54:23.744436  In 38:a4:ed:e1:ac:7f ethertype IPv4 (0x0800), length 68: 192.30.253.124.443 > 192.168.43.135.37698: Flags [.], ack 36, win 31, options [nop,nop,TS val 1881276180 ecr 417426143], length 0
21:54:24.101099  In 38:a4:ed:e1:ac:7f ethertype IPv4 (0x0800), length 68: 192.30.253.112.443 > 192.168.43.135.36996: Flags [.], ack 1, win 41, options [nop,nop,TS val 2518863642 ecr 2028072065], length 0
21:54:25.459727 Out 30:f7:72:29:e1:d3 ethertype IPv4 (0x0800), length 68: 192.168.43.135.36992 > 192.30.253.112.443: Flags [.], ack 1, win 1444, options [nop,nop,TS val 2028127098 ecr 2518861460], length 0
21:54:25.715639 Out 30:f7:72:29:e1:d3 ethertype IPv4 (0x0800), length 68: 192.168.43.135.48374 > 34.199.95.10.443: Flags [.], ack 1, win 335, options [nop,nop,TS val 3148302492 ecr 304099253], length 0
21:54:26.038785  In 38:a4:ed:e1:ac:7f ethertype IPv4 (0x0800), length 68: 192.30.253.112.443 > 192.168.43.135.36992: Flags [.], ack 1, win 44, options [nop,nop,TS val 2518864087 ecr 2028074740], length 0
21:54:26.038796  In 38:a4:ed:e1:ac:7f ethertype IPv4 (0x0800), length 68: 34.199.95.10.443 > 192.168.43.135.48374: Flags [.], ack 1, win 66, options [nop,nop,TS val 304101878 ecr 3148250328], length 0
21:54:26.227635 Out 30:f7:72:29:e1:d3 ethertype IPv4 (0x0800), length 68: 192.168.43.135.55536 > 35.171.223.36.443: Flags [.], ack 1, win 263, options [nop,nop,TS val 1421426305 ecr 115185063], length 0
21:54:26.659798  In 38:a4:ed:e1:ac:7f ethertype IPv4 (0x0800), length 68: 35.171.223.36.443 > 192.168.43.135.55536: Flags [.], ack 1, win 176, options [nop,nop,TS val 115187688 ecr 1421373930], length 0
21:54:27.763673 Out 30:f7:72:29:e1:d3 ethertype IPv4 (0x0800), length 68: 192.168.43.135.42124 > 192.30.253.116.443: Flags [.], ack 1, win 277, options [nop,nop,TS val 3603317194 ecr 1865477103], length 0
21:54:27.813613  In 00:00:00:00:00:00 ethertype IPv4 (0x0800), length 76: 127.0.0.1.48518 > 127.0.0.1.48518: UDP, length 32
21:54:27.825507  In 00:00:00:00:00:00 ethertype IPv4 (0x0800), length 68: 127.0.0.1.48518 > 127.0.0.1.48518: UDP, length 24
21:54:27.827865  In 00:00:00:00:00:00 ethertype IPv4 (0x0800), length 76: 127.0.0.1.48518 > 127.0.0.1.48518: UDP, length 32
21:54:27.838876  In 00:00:00:00:00:00 ethertype IPv4 (0x0800), length 980: 127.0.0.1.48518 > 127.0.0.1.48518: UDP, length 936
21:54:27.838905  In 00:00:00:00:00:00 ethertype IPv4 (0x0800), length 420: 127.0.0.1.48518 > 127.0.0.1.48518: UDP, length 376
21:54:27.838915  In 00:00:00:00:00:00 ethertype IPv4 (0x0800), length 532: 127.0.0.1.48518 > 127.0.0.1.48518: UDP, length 488
21:54:28.261818  In 38:a4:ed:e1:ac:7f ethertype IPv4 (0x0800), length 68: 192.30.253.116.443 > 192.168.43.135.42124: Flags [.], ack 1, win 76, options [nop,nop,TS val 1865479725 ecr 3603264736], length 0
21:54:30.323610 Out 30:f7:72:29:e1:d3 ethertype IPv4 (0x0800), length 68: 192.168.43.135.45068 > 117.18.237.29.80: Flags [.], ack 1, win 266, options [nop,nop,TS val 1038261055 ecr 1332311089], length 0
21:54:30.420446  In 38:a4:ed:e1:ac:7f ethertype IPv4 (0x0800), length 99: 192.30.253.112.443 > 192.168.43.135.36996: Flags [P.], seq 1:32, ack 1, win 41, options [nop,nop,TS val 2518865239 ecr 2028072065], length 31
21:54:30.420471 Out 30:f7:72:29:e1:d3 ethertype IPv4 (0x0800), length 68: 192.168.43.135.36996 > 192.30.253.112.443: Flags [.], ack 32, win 594, options [nop,nop,TS val 2028132055 ecr 2518865239], length 0
21:54:30.420624 Out 30:f7:72:29:e1:d3 ethertype IPv4 (0x0800), length 68: 192.168.43.135.36996 > 192.30.253.112.443: Flags [F.], seq 1, ack 32, win 594, options [nop,nop,TS val 2028132055 ecr 2518865239], length 0
21:54:30.421359  In 38:a4:ed:e1:ac:7f ethertype IPv4 (0x0800), length 68: 192.30.253.112.443 > 192.168.43.135.36996: Flags [F.], seq 32, ack 1, win 41, options [nop,nop,TS val 2518865239 ecr 2028072065], length 0
21:54:30.421378 Out 30:f7:72:29:e1:d3 ethertype IPv4 (0x0800), length 68: 192.168.43.135.36996 > 192.30.253.112.443: Flags [.], ack 33, win 594, options [nop,nop,TS val 2028132056 ecr 2518865239], length 0
21:54:30.426831  In 38:a4:ed:e1:ac:7f ethertype IPv4 (0x0800), length 68: 117.18.237.29.80 > 192.168.43.135.45068: Flags [.], ack 1, win 290, options [nop,nop,TS val 1332313651 ecr 1038148228], length 0
21:54:30.823135  In 38:a4:ed:e1:ac:7f ethertype IPv4 (0x0800), length 68: 192.30.253.112.443 > 192.168.43.135.36996: Flags [.], ack 2, win 41, options [nop,nop,TS val 2518865325 ecr 2028132055], length 0
21:54:32.449512 Out 30:f7:72:29:e1:d3 ethertype IPv4 (0x0800), length 114: 192.168.43.135.39052 > 18.232.242.2.443: Flags [P.], seq 2145202874:2145202920, ack 1902099067, win 279, options [nop,nop,TS val 2601075328 ecr 1706952583], length 46
21:54:32.752058  In 38:a4:ed:e1:ac:7f ethertype IPv4 (0x0800), length 114: 18.232.242.2.443 > 192.168.43.135.39052: Flags [P.], seq 1:47, ack 46, win 193, options [nop,nop,TS val 1706967276 ecr 2601075328], length 46
21:54:32.752095 Out 30:f7:72:29:e1:d3 ethertype IPv4 (0x0800), length 68: 192.168.43.135.39052 > 18.232.242.2.443: Flags [.], ack 47, win 279, options [nop,nop,TS val 2601075631 ecr 1706967276], length 0
21:54:32.848905 Out 30:f7:72:29:e1:d3 ethertype IPv4 (0x0800), length 68: 192.168.43.135.45068 > 117.18.237.29.80: Flags [F.], seq 1, ack 1, win 266, options [nop,nop,TS val 1038263578 ecr 1332313651], length 0
21:54:32.943948  In 38:a4:ed:e1:ac:7f ethertype IPv4 (0x0800), length 68: 117.18.237.29.80 > 192.168.43.135.45068: Flags [F.], seq 1, ack 2, win 290, options [nop,nop,TS val 1332314281 ecr 1038263578], length 0
21:54:32.943990 Out 30:f7:72:29:e1:d3 ethertype IPv4 (0x0800), length 68: 192.168.43.135.45068 > 117.18.237.29.80: Flags [.], ack 2, win 266, options [nop,nop,TS val 1038263673 ecr 1332314281], length 0
21:54:33.017100  In 38:a4:ed:e1:ac:7f ethertype IPv4 (0x0800), length 99: 192.30.253.112.443 > 192.168.43.135.36992: Flags [P.], seq 1:32, ack 1, win 44, options [nop,nop,TS val 2518865886 ecr 2028074740], length 31
21:54:33.017142 Out 30:f7:72:29:e1:d3 ethertype IPv4 (0x0800), length 68: 192.168.43.135.36992 > 192.30.253.112.443: Flags [.], ack 32, win 1444, options [nop,nop,TS val 2028134649 ecr 2518865886], length 0
21:54:33.017267  In 38:a4:ed:e1:ac:7f ethertype IPv4 (0x0800), length 68: 192.30.253.112.443 > 192.168.43.135.36992: Flags [F.], seq 32, ack 1, win 44, options [nop,nop,TS val 2518865886 ecr 2028074740], length 0
21:54:33.017368 Out 30:f7:72:29:e1:d3 ethertype IPv4 (0x0800), length 68: 192.168.43.135.36992 > 192.30.253.112.443: Flags [F.], seq 1, ack 33, win 1444, options [nop,nop,TS val 2028134650 ecr 2518865886], length 0
21:54:33.385326  In 38:a4:ed:e1:ac:7f ethertype IPv4 (0x0800), length 68: 192.30.253.112.443 > 192.168.43.135.36992: Flags [.], ack 2, win 44, options [nop,nop,TS val 2518865972 ecr 2028134650], length 0
21:54:34.025320  In 38:a4:ed:e1:ac:7f ethertype IPv4 (0x0800), length 99: 34.199.95.10.443 > 192.168.43.135.48374: Flags [P.], seq 1:32, ack 1, win 66, options [nop,nop,TS val 304103826 ecr 3148250328], length 31
21:54:34.025369 Out 30:f7:72:29:e1:d3 ethertype IPv4 (0x0800), length 68: 192.168.43.135.48374 > 34.199.95.10.443: Flags [.], ack 32, win 335, options [nop,nop,TS val 3148310795 ecr 304103826], length 0
21:54:34.025565  In 38:a4:ed:e1:ac:7f ethertype IPv4 (0x0800), length 99: 35.171.223.36.443 > 192.168.43.135.55536: Flags [P.], seq 1:32, ack 1, win 176, options [nop,nop,TS val 115189544 ecr 1421373930], length 31
21:54:34.025578 Out 30:f7:72:29:e1:d3 ethertype IPv4 (0x0800), length 68: 192.168.43.135.55536 > 35.171.223.36.443: Flags [.], ack 32, win 263, options [nop,nop,TS val 1421434097 ecr 115189544], length 0
21:54:34.025752 Out 30:f7:72:29:e1:d3 ethertype IPv4 (0x0800), length 68: 192.168.43.135.48374 > 34.199.95.10.443: Flags [F.], seq 1, ack 32, win 335, options [nop,nop,TS val 3148310795 ecr 304103826], length 0
21:54:34.026141 Out 30:f7:72:29:e1:d3 ethertype IPv4 (0x0800), length 68: 192.168.43.135.55536 > 35.171.223.36.443: Flags [F.], seq 1, ack 32, win 263, options [nop,nop,TS val 1421434098 ecr 115189544], length 0
21:54:34.345851  In 38:a4:ed:e1:ac:7f ethertype IPv4 (0x0800), length 68: 34.199.95.10.443 > 192.168.43.135.48374: Flags [F.], seq 32, ack 2, win 66, options [nop,nop,TS val 304103948 ecr 3148310795], length 0
21:54:34.345892 Out 30:f7:72:29:e1:d3 ethertype IPv4 (0x0800), length 68: 192.168.43.135.48374 > 34.199.95.10.443: Flags [.], ack 33, win 335, options [nop,nop,TS val 3148311115 ecr 304103948], length 0
21:54:34.345996  In 38:a4:ed:e1:ac:7f ethertype IPv4 (0x0800), length 68: 35.171.223.36.443 > 192.168.43.135.55536: Flags [F.], seq 32, ack 2, win 176, options [nop,nop,TS val 115189633 ecr 1421434098], length 0
21:54:34.346007 Out 30:f7:72:29:e1:d3 ethertype IPv4 (0x0800), length 68: 192.168.43.135.55536 > 35.171.223.36.443: Flags [.], ack 33, win 263, options [nop,nop,TS val 1421434417 ecr 115189633], length 0
21:54:34.666418  In 38:a4:ed:e1:ac:7f ethertype IPv4 (0x0800), length 99: 192.30.253.116.443 > 192.168.43.135.42124: Flags [P.], seq 1:32, ack 1, win 76, options [nop,nop,TS val 1865481315 ecr 3603264736], length 31
21:54:34.666464 Out 30:f7:72:29:e1:d3 ethertype IPv4 (0x0800), length 68: 192.168.43.135.42124 > 192.30.253.116.443: Flags [.], ack 32, win 277, options [nop,nop,TS val 3603324092 ecr 1865481315], length 0
21:54:34.666684 Out 30:f7:72:29:e1:d3 ethertype IPv4 (0x0800), length 68: 192.168.43.135.42124 > 192.30.253.116.443: Flags [F.], seq 1, ack 32, win 277, options [nop,nop,TS val 3603324092 ecr 1865481315], length 0
21:54:34.666692  In 38:a4:ed:e1:ac:7f ethertype IPv4 (0x0800), length 68: 192.30.253.116.443 > 192.168.43.135.42124: Flags [F.], seq 32, ack 1, win 76, options [nop,nop,TS val 1865481315 ecr 3603264736], length 0
21:54:34.666726 Out 30:f7:72:29:e1:d3 ethertype IPv4 (0x0800), length 68: 192.168.43.135.42124 > 192.30.253.116.443: Flags [.], ack 33, win 277, options [nop,nop,TS val 3603324092 ecr 1865481315], length 0
21:54:35.308414  In 38:a4:ed:e1:ac:7f ethertype IPv4 (0x0800), length 68: 192.30.253.116.443 > 192.168.43.135.42124: Flags [.], ack 2, win 76, options [nop,nop,TS val 1865481447 ecr 3603324092], length 0
21:54:35.308445  In 38:a4:ed:e1:ac:7f ethertype IPv4 (0x0800), length 99: 192.30.253.124.443 > 192.168.43.135.37834: Flags [P.], seq 4133748303:4133748334, ack 595284292, win 31, options [nop,nop,TS val 1881279026 ecr 417377473], length 31
21:54:35.308612 Out 30:f7:72:29:e1:d3 ethertype IPv4 (0x0800), length 103: 192.168.43.135.37834 > 192.30.253.124.443: Flags [P.], seq 1:36, ack 31, win 245, options [nop,nop,TS val 417438067 ecr 1881279026], length 35
21:54:35.947637  In 38:a4:ed:e1:ac:7f ethertype IPv4 (0x0800), length 68: 192.30.253.124.443 > 192.168.43.135.37834: Flags [.], ack 36, win 31, options [nop,nop,TS val 1881279162 ecr 417438067], length 0
